{
  "$schema": "https://json-schema.org/draft/2020-12/schema",
  "title": "ObservedHourlyByBA",
  "type": "object",
  "required": [
    "timestamp_utc",
    "timestamp_local",
    "ba_code",
    "ba_name",
    "interconnection",
    "lat",
    "lon",
    "demand_mw",
    "total_generation_mw",
    "wind_mw",
    "solar_mw",
    "interchange_mw",
    "wind_solar_mw",
    "wind_solar_share_of_generation"
  ],
  "properties": {
    "timestamp_utc": {"type": "string"},
    "timestamp_local": {"type": "string"},
    "ba_code": {"type": "string"},
    "ba_name": {"type": "string"},
    "interconnection": {"type": "string"},
    "lat": {"type": "number"},
    "lon": {"type": "number"},
    "demand_mw": {"type": "number"},
    "total_generation_mw": {"type": "number"},
    "wind_mw": {"type": "number"},
    "solar_mw": {"type": "number"},
    "interchange_mw": {"type": "number"},
    "wind_solar_mw": {"type": "number"},
    "wind_solar_share_of_generation": {"type": "number", "minimum": 0}
  }
}
