[
  {
    "timestamp_utc": "2026-01-15T00:00:00Z",
    "timestamp_local": "2026-01-14 16:00",
    "ba_code": "CAISO",
    "ba_name": "California ISO",
    "interconnection": "western",
    "lat": 38.58,
    "lon": -121.49,
    "demand_mw": 29680.0,
    "total_generation_mw": 28789.6,
    "wind_mw": 5639.2,
    "solar_mw": 593.6,
    "interchange_mw": -890.4,
    "wind_solar_mw": 6232.8,
    "wind_solar_share_of_generation": 0.2165
  },
  {
    "timestamp_utc": "2026-01-15T00:00:00Z",
    "timestamp_local": "2026-01-14 18:00",
    "ba_code": "ERCOT",
    "ba_name": "Electric Reliability Council of Texas",
    "interconnection": "ercot",
    "lat": 30.27,
    "lon": -97.74,
    "demand_mw": 50880.0,
    "total_generation_mw": 51643.2,
    "wind_mw": 10557.6,
    "solar_mw": 1017.6,
    "interchange_mw": 763.2,
    "wind_solar_mw": 11575.2,
    "wind_solar_share_of_generation": 0.2241
  },
  {
    "timestamp_utc": "2026-01-15T00:00:00Z",
    "timestamp_local": "2026-01-14 18:00",
    "ba_code": "MISO",
    "ba_name": "Midcontinent ISO",
    "interconnection": "eastern",
    "lat": 42.0,
    "lon": -93.0,
    "demand_mw": 55120.0,
    "total_generation_mw": 54293.2,
    "wind_mw": 10794.33,
    "solar_mw": 1102.4,
    "interchange_mw": -826.8,
    "wind_solar_mw": 11896.73,
    "wind_solar_share_of_generation": 0.2191
  },
  {
    "timestamp_utc": "2026-01-15T00:00:00Z",
    "timestamp_local": "2026-01-14 19:00",
    "ba_code": "NYISO",
    "ba_name": "New York ISO",
    "interconnection": "eastern",
    "lat": 42.65,
    "lon": -73.75,
    "demand_mw": 25440.0,
    "total_generation_mw": 25058.4,
    "wind_mw": 5575.6,
    "solar_mw": 508.8,
    "interchange_mw": -381.6,
    "wind_solar_mw": 6084.4,
    "wind_solar_share_of_generation": 0.2428
  },
  {
    "timestamp_utc": "2026-01-15T00:00:00Z",
    "timestamp_local": "2026-01-14 19:00",
    "ba_code": "PJM",
    "ba_name": "PJM Interconnection",
    "interconnection": "eastern",
    "lat": 39.95,
    "lon": -75.16,
    "demand_mw": 72080.0,
    "total_generation_mw": 72080.0,
    "wind_mw": 14536.13,
    "solar_mw": 1441.6,
    "interchange_mw": 0.0,
    "wind_solar_mw": 15977.73,
    "wind_solar_share_of_generation": 0.2217
  },
  {
    "timestamp_utc": "2026-01-15T00:00:00Z",
    "timestamp_local": "2026-01-14 18:00",
    "ba_code": "SPP",
    "ba_name": "Southwest Power Pool",
    "interconnection": "eastern",
    "lat": 35.47,
    "lon": -97.52,
    "demand_mw": 23320.0,
    "total_generation_mw": 22620.4,
    "wind_mw": 4974.93,
    "solar_mw": 466.4,
    "interchange_mw": -699.6,
    "wind_solar_mw": 5441.33,
    "wind_solar_share_of_generation": 0.2405
  },
  {
    "timestamp_utc": "2026-01-15T01:00:00Z",
    "timestamp_local": "2026-01-14 17:00",
    "ba_code": "CAISO",
    "ba_name": "California ISO",
    "interconnection": "western",
    "lat": 38.58,
    "lon": -121.49,
    "demand_mw": 29260.0,
    "total_generation_mw": 28821.1,
    "wind_mw": 5644.74,
    "solar_mw": 585.2,
    "interchange_mw": -438.9,
    "wind_solar_mw": 6229.94,
    "wind_solar_share_of_generation": 0.2162
  },
  {
    "timestamp_utc": "2026-01-15T01:00:00Z",
    "timestamp_local": "2026-01-14 19:00",
    "ba_code": "ERCOT",
    "ba_name": "Electric Reliability Council of Texas",
    "interconnection": "ercot",
    "lat": 30.27,
    "lon": -97.74,
    "demand_mw": 50160.0,
    "total_generation_mw": 48655.2,
    "wind_mw": 10554.5,
    "solar_mw": 1003.2,
    "interchange_mw": -1504.8,
    "wind_solar_mw": 11557.7,
    "wind_solar_share_of_generation": 0.2375
  },
  {
    "timestamp_utc": "2026-01-15T01:00:00Z",
    "timestamp_local": "2026-01-14 19:00",
    "ba_code": "MISO",
    "ba_name": "Midcontinent ISO",
    "interconnection": "eastern",
    "lat": 42.0,
    "lon": -93.0,
    "demand_mw": 54340.0,
    "total_generation_mw": 54340.0,
    "wind_mw": 10800.07,
    "solar_mw": 1086.8,
    "interchange_mw": 0.0,
    "wind_solar_mw": 11886.87,
    "wind_solar_share_of_generation": 0.2187
  },
  {
    "timestamp_utc": "2026-01-15T01:00:00Z",
    "timestamp_local": "2026-01-14 20:00",
    "ba_code": "NYISO",
    "ba_name": "New York ISO",
    "interconnection": "eastern",
    "lat": 42.65,
    "lon": -73.75,
    "demand_mw": 25080.0,
    "total_generation_mw": 25080.0,
    "wind_mw": 5569.85,
    "solar_mw": 501.6,
    "interchange_mw": 0.0,
    "wind_solar_mw": 6071.45,
    "wind_solar_share_of_generation": 0.2421
  },
  {
    "timestamp_utc": "2026-01-15T01:00:00Z",
    "timestamp_local": "2026-01-14 20:00",
    "ba_code": "PJM",
    "ba_name": "PJM Interconnection",
    "interconnection": "eastern",
    "lat": 39.95,
    "lon": -75.16,
    "demand_mw": 71060.0,
    "total_generation_mw": 72125.9,
    "wind_mw": 14537.69,
    "solar_mw": 1421.2,
    "interchange_mw": 1065.9,
    "wind_solar_mw": 15958.89,
    "wind_solar_share_of_generation": 0.2213
  },
  {
    "timestamp_utc": "2026-01-15T01:00:00Z",
    "timestamp_local": "2026-01-14 19:00",
    "ba_code": "SPP",
    "ba_name": "Southwest Power Pool",
    "interconnection": "eastern",
    "lat": 35.47,
    "lon": -97.52,
    "demand_mw": 22990.0,
    "total_generation_mw": 22645.15,
    "wind_mw": 4971.59,
    "solar_mw": 459.8,
    "interchange_mw": -344.85,
    "wind_solar_mw": 5431.39,
    "wind_solar_share_of_generation": 0.2398
  },
  {
    "timestamp_utc": "2026-01-15T02:00:00Z",
    "timestamp_local": "2026-01-14 18:00",
    "ba_code": "CAISO",
    "ba_name": "California ISO",
    "interconnection": "western",
    "lat": 38.58,
    "lon": -121.49,
    "demand_mw": 28840.0,
    "total_generation_mw": 28840.0,
    "wind_mw": 5647.83,
    "solar_mw": 576.8,
    "interchange_mw": 0.0,
    "wind_solar_mw": 6224.63,
    "wind_solar_share_of_generation": 0.2158
  },
  {
    "timestamp_utc": "2026-01-15T02:00:00Z",
    "timestamp_local": "2026-01-14 20:00",
    "ba_code": "ERCOT",
    "ba_name": "Electric Reliability Council of Texas",
    "interconnection": "ercot",
    "lat": 30.27,
    "lon": -97.74,
    "demand_mw": 49440.0,
    "total_generation_mw": 48698.4,
    "wind_mw": 10547.2,
    "solar_mw": 988.8,
    "interchange_mw": -741.6,
    "wind_solar_mw": 11536.0,
    "wind_solar_share_of_generation": 0.2369
  },
  {
    "timestamp_utc": "2026-01-15T02:00:00Z",
    "timestamp_local": "2026-01-14 20:00",
    "ba_code": "MISO",
    "ba_name": "Midcontinent ISO",
    "interconnection": "eastern",
    "lat": 42.0,
    "lon": -93.0,
    "demand_mw": 53560.0,
    "total_generation_mw": 54363.4,
    "wind_mw": 10801.27,
    "solar_mw": 1071.2,
    "interchange_mw": 803.4,
    "wind_solar_mw": 11872.47,
    "wind_solar_share_of_generation": 0.2184
  },
  {
    "timestamp_utc": "2026-01-15T02:00:00Z",
    "timestamp_local": "2026-01-14 21:00",
    "ba_code": "NYISO",
    "ba_name": "New York ISO",
    "interconnection": "eastern",
    "lat": 42.65,
    "lon": -73.75,
    "demand_mw": 24720.0,
    "total_generation_mw": 25090.8,
    "wind_mw": 5562.0,
    "solar_mw": 494.4,
    "interchange_mw": 370.8,
    "wind_solar_mw": 6056.4,
    "wind_solar_share_of_generation": 0.2414
  },
  {
    "timestamp_utc": "2026-01-15T02:00:00Z",
    "timestamp_local": "2026-01-14 21:00",
    "ba_code": "PJM",
    "ba_name": "PJM Interconnection",
    "interconnection": "eastern",
    "lat": 39.95,
    "lon": -75.16,
    "demand_mw": 70040.0,
    "total_generation_mw": 67938.8,
    "wind_mw": 14533.3,
    "solar_mw": 1400.8,
    "interchange_mw": -2101.2,
    "wind_solar_mw": 15934.1,
    "wind_solar_share_of_generation": 0.2345
  },
  {
    "timestamp_utc": "2026-01-15T02:00:00Z",
    "timestamp_local": "2026-01-14 20:00",
    "ba_code": "SPP",
    "ba_name": "Southwest Power Pool",
    "interconnection": "eastern",
    "lat": 35.47,
    "lon": -97.52,
    "demand_mw": 22660.0,
    "total_generation_mw": 22660.0,
    "wind_mw": 4966.32,
    "solar_mw": 453.2,
    "interchange_mw": 0.0,
    "wind_solar_mw": 5419.52,
    "wind_solar_share_of_generation": 0.2392
  },
  {
    "timestamp_utc": "2026-01-15T03:00:00Z",
    "timestamp_local": "2026-01-14 19:00",
    "ba_code": "CAISO",
    "ba_name": "California ISO",
    "interconnection": "western",
    "lat": 38.58,
    "lon": -121.49,
    "demand_mw": 28420.0,
    "total_generation_mw": 28846.3,
    "wind_mw": 5648.47,
    "solar_mw": 568.4,
    "interchange_mw": 426.3,
    "wind_solar_mw": 6216.87,
    "wind_solar_share_of_generation": 0.2155
  },
  {
    "timestamp_utc": "2026-01-15T03:00:00Z",
    "timestamp_local": "2026-01-14 21:00",
    "ba_code": "ERCOT",
    "ba_name": "Electric Reliability Council of Texas",
    "interconnection": "ercot",
    "lat": 30.27,
    "lon": -97.74,
    "demand_mw": 48720.0,
    "total_generation_mw": 48720.0,
    "wind_mw": 10535.7,
    "solar_mw": 974.4,
    "interchange_mw": 0.0,
    "wind_solar_mw": 11510.1,
    "wind_solar_share_of_generation": 0.2363
  },
  {
    "timestamp_utc": "2026-01-15T03:00:00Z",
    "timestamp_local": "2026-01-14 21:00",
    "ba_code": "MISO",
    "ba_name": "Midcontinent ISO",
    "interconnection": "eastern",
    "lat": 42.0,
    "lon": -93.0,
    "demand_mw": 52780.0,
    "total_generation_mw": 51196.6,
    "wind_mw": 10797.91,
    "solar_mw": 1055.6,
    "interchange_mw": -1583.4,
    "wind_solar_mw": 11853.51,
    "wind_solar_share_of_generation": 0.2315
  },
  {
    "timestamp_utc": "2026-01-15T03:00:00Z",
    "timestamp_local": "2026-01-14 22:00",
    "ba_code": "NYISO",
    "ba_name": "New York ISO",
    "interconnection": "eastern",
    "lat": 42.65,
    "lon": -73.75,
    "demand_mw": 24360.0,
    "total_generation_mw": 23629.2,
    "wind_mw": 5552.05,
    "solar_mw": 487.2,
    "interchange_mw": -730.8,
    "wind_solar_mw": 6039.25,
    "wind_solar_share_of_generation": 0.2556
  },
  {
    "timestamp_utc": "2026-01-15T03:00:00Z",
    "timestamp_local": "2026-01-14 22:00",
    "ba_code": "PJM",
    "ba_name": "PJM Interconnection",
    "interconnection": "eastern",
    "lat": 39.95,
    "lon": -75.16,